{
  "schema_version": "0.1.0",
  "profile_id": "low_poly_girl_rig_v0_calibration_v0_1",
  "rig_profile_id": "low_poly_girl_rig_v0",
  "source": {
    "path": "assets/characters/low_poly_girl/low_poly_girl .glb",
    "sha256": "a162d8730238a76ba1d6b31910c98fb1f5640c46917983e0bbad04095e81b7b2",
    "armature": "Rig"
  },
  "seed": {
    "path": "assets/characters/low_poly_girl/ballet_rig_calibration_seed_v1.json",
    "sha256": "4c9183b2c6c94cae985f40558d6074c6cb7afa89cb93fc16ff8eae0bbdbd6c9b"
  },
  "coordinate_space": "BLENDER_ARMATURE_LOCAL",
  "anatomical_frame": {
    "up": [
      0.0,
      0.0,
      1.0
    ],
    "left": [
      1.0,
      0.0,
      0.0
    ],
    "front": [
      0.0,
      -1.0,
      0.0
    ]
  },
  "canonical_bones": {
    "pelvis": {
      "rig_bone": "Hips",
      "parent": null,
      "length": 0.12618017,
      "head_local": [
        -1e-08,
        0.00955532,
        0.84759498
      ],
      "tail_local": [
        -1e-08,
        0.00955532,
        0.97377515
      ],
      "matrix_local": [
        [
          1.0,
          0.0,
          7.2e-07,
          -1e-08
        ],
        [
          7.2e-07,
          4e-08,
          -1.0,
          0.00955532
        ],
        [
          -0.0,
          1.0,
          0.0,
          0.84759498
        ],
        [
          0.0,
          0.0,
          0.0,
          1.0
        ]
      ],
      "rest_axes": {
        "x": [
          1.0,
          7.2e-07,
          -0.0
        ],
        "y_length": [
          0.0,
          4e-08,
          1.0
        ],
        "z": [
          7.2e-07,
          -1.0,
          0.0
        ]
      }
    },
    "spine_lower": {
      "rig_bone": "Spine",
      "parent": "Hips",
      "length": 0.13342595,
      "head_local": [
        -1e-08,
        0.00955531,
        0.97377515
      ],
      "tail_local": [
        -2e-08,
        0.03535469,
        1.10468304
      ],
      "matrix_local": [
        [
          1.0,
          -1.3e-07,
          8.7e-07,
          -1e-08
        ],
        [
          8.8e-07,
          0.19336098,
          -0.98112768,
          0.00955531
        ],
        [
          -4e-08,
          0.98112768,
          0.19336095,
          0.97377515
        ],
        [
          0.0,
          0.0,
          0.0,
          1.0
        ]
      ],
      "rest_axes": {
        "x": [
          1.0,
          8.8e-07,
          -4e-08
        ],
        "y_length": [
          -1.3e-07,
          0.19336098,
          0.98112768
        ],
        "z": [
          8.7e-07,
          -0.98112768,
          0.19336095
        ]
      }
    },
    "spine_mid": {
      "rig_bone": "Spine 1",
      "parent": "Spine",
      "length": 0.13132945,
      "head_local": [
        -2e-08,
        0.03535468,
        1.10468304
      ],
      "tail_local": [
        -3e-08,
        0.04586555,
        1.23559117
      ],
      "matrix_local": [
        [
          1.0,
          -5e-08,
          9.4e-07,
          -2e-08
        ],
        [
          9.5e-07,
          0.08003443,
          -0.99679214,
          0.03535467
        ],
        [
          -2e-08,
          0.99679208,
          0.08003441,
          1.10468304
        ],
        [
          0.0,
          0.0,
          0.0,
          1.0
        ]
      ],
      "rest_axes": {
        "x": [
          1.0,
          9.5e-07,
          -2e-08
        ],
        "y_length": [
          -5e-08,
          0.08003443,
          0.99679208
        ],
        "z": [
          9.4e-07,
          -0.99679214,
          0.08003441
        ]
      }
    },
    "chest": {
      "rig_bone": "Chest",
      "parent": "Spine 1",
      "length": 0.21964659,
      "head_local": [
        -3e-08,
        0.04586551,
        1.23559117
      ],
      "tail_local": [
        -0.00133903,
        0.02594832,
        1.45432878
      ],
      "matrix_local": [
        [
          -0.9998945,
          -0.00609615,
          0.01318394,
          -3e-08
        ],
        [
          0.01368262,
          -0.09067836,
          0.99578631,
          0.04586551
        ],
        [
          -0.00487496,
          0.99586183,
          0.09075217,
          1.23559117
        ],
        [
          0.0,
          0.0,
          0.0,
          1.0
        ]
      ],
      "rest_axes": {
        "x": [
          -0.9998945,
          0.01368262,
          -0.00487496
        ],
        "y_length": [
          -0.00609614,
          -0.09067834,
          0.99586159
        ],
        "z": [
          0.01318394,
          0.99578619,
          0.09075216
        ]
      }
    },
    "neck": {
      "rig_bone": "Neck",
      "parent": "Chest",
      "length": 0.12012029,
      "head_local": [
        -0.00133903,
        0.02594837,
        1.45432878
      ],
      "tail_local": [
        0.0,
        -0.00053082,
        1.57148659
      ],
      "matrix_local": [
        [
          -0.99993771,
          0.01114743,
          0.00049579,
          -0.00133903
        ],
        [
          -0.00197386,
          -0.22043893,
          0.97539884,
          0.02594836
        ],
        [
          0.01098249,
          0.97533727,
          0.22044721,
          1.45432878
        ],
        [
          0.0,
          0.0,
          0.0,
          1.0
        ]
      ],
      "rest_axes": {
        "x": [
          -0.99993771,
          -0.00197386,
          0.01098249
        ],
        "y_length": [
          0.01114743,
          -0.22043887,
          0.97533703
        ],
        "z": [
          0.00049579,
          0.97539884,
          0.22044721
        ]
      }
    },
    "head": {
      "rig_bone": "Head",
      "parent": "Neck",
      "length": 0.01201212,
      "head_local": [
        0.0,
        -0.0005308,
        1.57148659
      ],
      "tail_local": [
        0.0,
        -0.00043864,
        1.58349836
      ],
      "matrix_local": [
        [
          1.0,
          -0.0,
          -1.55e-06,
          0.0
        ],
        [
          -1.55e-06,
          0.00767227,
          -0.99997067,
          -0.00053081
        ],
        [
          1e-08,
          0.99997067,
          0.00767227,
          1.57148659
        ],
        [
          0.0,
          0.0,
          0.0,
          1.0
        ]
      ],
      "rest_axes": {
        "x": [
          1.0,
          -1.55e-06,
          1e-08
        ],
        "y_length": [
          -0.0,
          0.00767226,
          0.99997056
        ],
        "z": [
          -1.55e-06,
          -0.99997056,
          0.00767226
        ]
      }
    },
    "left_clavicle": {
      "rig_bone": "Clavicle_L",
      "parent": "Chest",
      "length": 0.14900087,
      "head_local": [
        -0.00133899,
        0.02594833,
        1.45432925
      ],
      "tail_local": [
        0.14538893,
        0.03837907,
        1.43157732
      ],
      "matrix_local": [
        [
          0.08170023,
          0.98474574,
          0.15362765,
          -0.00133899
        ],
        [
          -0.99650246,
          0.08342728,
          -0.00481971,
          0.02594832
        ],
        [
          -0.01756293,
          -0.15269662,
          0.98811746,
          1.45432925
        ],
        [
          0.0,
          0.0,
          0.0,
          1.0
        ]
      ],
      "rest_axes": {
        "x": [
          0.08170021,
          -0.99650222,
          -0.01756293
        ],
        "y_length": [
          0.9847455,
          0.08342726,
          -0.15269659
        ],
        "z": [
          0.15362759,
          -0.00481971,
          0.9881171
        ]
      }
    },
    "right_clavicle": {
      "rig_bone": "Clavicle_R",
      "parent": "Chest",
      "length": 0.14636087,
      "head_local": [
        -0.00133906,
        0.02594833,
        1.45432901
      ],
      "tail_local": [
        -0.1453702,
        0.03841935,
        1.43150318
      ],
      "matrix_local": [
        [
          0.08287531,
          -0.98408222,
          -0.15720749,
          -0.00133906
        ],
        [
          0.9963302,
          0.08520736,
          -0.00814168,
          0.02594832
        ],
        [
          0.02140729,
          -0.15595585,
          0.98753232,
          1.45432901
        ],
        [
          0.0,
          0.0,
          0.0,
          1.0
        ]
      ],
      "rest_axes": {
        "x": [
          0.08287529,
          0.99632996,
          0.02140729
        ],
        "y_length": [
          -0.9840821,
          0.08520735,
          -0.15595584
        ],
        "z": [
          -0.15720744,
          -0.00814168,
          0.98753208
        ]
      }
    },
    "left_upper_arm": {
      "rig_bone": "Upper_Arm_L",
      "parent": "Clavicle_L",
      "length": 0.25150174,
      "head_local": [
        0.1455774,
        0.03647204,
        1.43183279
      ],
      "tail_local": [
        0.35823095,
        0.03661842,
        1.29755092
      ],
      "matrix_local": [
        [
          0.00108066,
          0.8455351,
          0.53391933,
          0.14557743
        ],
        [
          -0.99999952,
          0.000582,
          0.00110185,
          0.03647203
        ],
        [
          0.00062091,
          -0.53392029,
          0.84553504,
          1.43183279
        ],
        [
          0.0,
          0.0,
          0.0,
          1.0
        ]
      ],
      "rest_axes": {
        "x": [
          0.00108066,
          -0.99999917,
          0.00062091
        ],
        "y_length": [
          0.8455348,
          0.000582,
          -0.53392011
        ],
        "z": [
          0.53391922,
          0.00110185,
          0.84553486
        ]
      }
    },
    "right_upper_arm": {
      "rig_bone": "Upper_Arm_R",
      "parent": "Clavicle_R",
      "length": 0.25150159,
      "head_local": [
        -0.14557742,
        0.03647193,
        1.43183303
      ],